reports/feature_importance.csv

Feature,Decision_Tree_Importance,Random_Forest_Importance
path_length,0.9807761598315108,0.38786739647458424
token_count,0.001447017870908393,0.15055007466112091
https_flag,0.0038902025776739366,0.13401047353722043
number_of_digits,1.5250211286921706e-05,0.10805847587775926
percentage_numeric_chars,9.994101092562753e-06,0.09561370106436609
dot_count,0.00611138916865182,0.04184736939436245
subdomain_count,0.0034691134216319718,0.0219942809494516
tld_length,0.0,0.019787984746610296
has_ip_address,0.0,0.014496305601457744
url_length,0.0013670990198195346,0.013579770885454047
domain_name_length,0.00010480604597484863,0.006942613275354416
url_entropy,0.0005335179510550536,0.002238832335461298
suspicious_file_extension,8.89024425026916e-06,0.0017289381160976696
tld_popularity,0.002262322247641843,0.0011125393893237237
has_hyphen_in_domain,0.0,0.00011479584899654534
query_param_count,4.237308502085704e-06,5.644784237926679e-05

README.md

### Analisis Feature Importance (Gini Importance):

1. `path_length` (**38.79%**): Panjang direktori path merupakan pembeda terkuat antara halaman login palsu dan situs normal.
2. `token_count` (**15.06%**): URL phishing cenderung memiliki struktur token berlebihan.
3. `https_flag` (**13.40%**): Protokol transportasi URL.
4. `number_of_digits` (**10.81%**) & `percentage_numeric_chars` (**9.56%**): Phishing URL sering memuat string acak atau parameter numerik panjang.